{
  "schema_version": "1.0.0",
  "id": "EVD-WP-2026-0136-G07-unit-test",
  "work_package_id": "WP-2026-0136",
  "gate": "G07",
  "claim": "unit tests run in the composed-tree gate, not here",
  "evidence_type": "unit-test",
  "producer": {
    "id": "badf-self-dossier",
    "type": "controller"
  },
  "source_revision": "HEAD",
  "target": "bstBizEra/badf:main",
  "toolchain": {
    "name": "deferred-to-compose",
    "version": "1"
  },
  "operation": "deferred-to-compose",
  "started_at": "2026-09-02T07:56:36Z",
  "completed_at": "2026-09-02T07:56:36Z",
  "outcome": "NOT_RUN",
  "artifact": "work/WP-2026-0136/evidence/G07/unit-test.txt",
  "digest": "sha256:3ebfe5e512dfeda144788ffffd16868b94226c8875f266fe231350792fa89fbc",
  "binding": {
    "obligations": [
      {
        "id": "TEST-001",
        "seam": {
          "type": "module",
          "ref": "tests/test_badf_uat_contract.py"
        },
        "red": {
          "observed": true,
          "ref": "work/WP-2026-0136/evidence/G07/failing-first.txt",
          "digest": "sha256:12ed3d796738610989b2084ad57fdf61d6222bcf9d46a0c0401789ee65c27a6a"
        },
        "green": {
          "observed": false
        }
      }
    ],
    "command": "deferred-to-compose",
    "result": "NOT_RUN",
    "tests_run": 0,
    "failures": 0,
    "coverage_scope": [
      "tests/test_badf_uat_contract.py"
    ],
    "fresh_run": "scripts/badf_compose.py (the composed-tree gate) re-runs the suite on the tree that would land; CI is the fresh, authoritative run (BLD-I09)"
  }
}
