{
  "schema_version": "1.0.0",
  "id": "EVD-WP-2026-0127-G07-unit-test",
  "work_package_id": "WP-2026-0127",
  "gate": "G07",
  "claim": "the author's unit-test run, bound; the composed-tree gate is the fresh run",
  "evidence_type": "unit-test",
  "producer": {
    "id": "badf-self-dossier",
    "type": "controller"
  },
  "source_revision": "HEAD",
  "target": "bstBizEra/badf:main",
  "toolchain": {
    "name": "unittest",
    "version": "1"
  },
  "operation": "python3 -B -m unittest -v tests.test_badf_verification_evidence",
  "started_at": "2026-09-01T03:07:37Z",
  "completed_at": "2026-09-01T03:07:37Z",
  "outcome": "PASS",
  "artifact": "work/WP-2026-0127/evidence/G07/unit-test.log",
  "digest": "sha256:60bdbeedfffb4a7a17256ce9dd6cd2ff85d044e4b140db8055e4af35c4035829",
  "binding": {
    "obligations": [
      {
        "id": "TEST-001",
        "seam": {
          "type": "module",
          "ref": "tests/test_badf_verification_evidence.py"
        },
        "red": {
          "observed": true,
          "ref": "work/WP-2026-0127/evidence/G07/failing-first.txt",
          "digest": "sha256:1e677dcea0b67b25f18f7c700f2229b87a3ab4240ce44636a4bd6e4a783039ed"
        },
        "green": {
          "observed": true,
          "ref": "work/WP-2026-0127/evidence/G07/unit-test.log",
          "digest": "sha256:60bdbeedfffb4a7a17256ce9dd6cd2ff85d044e4b140db8055e4af35c4035829"
        }
      }
    ],
    "command": "python3 -B -m unittest -v tests.test_badf_verification_evidence",
    "result": "PASS",
    "tests_run": 21,
    "failures": 0,
    "coverage_scope": [
      "tests/test_badf_verification_evidence.py"
    ],
    "fresh_run": "scripts/badf_compose.py (the composed-tree gate) re-runs the suite on the tree that would land; CI is the fresh, authoritative run (BLD-I09)"
  }
}
